{
  "fixtureVersion": "1.0",
  "fixtureId": "positive.security.kms-operation-grant",
  "category": "positive",
  "schemaId": "urn:psdc:contracts:security:kms-operation-grant:1",
  "description": "Purpose-bound unwrap grant for one encrypted object.",
  "expected": { "schemaValid": true, "semanticOutcome": "accept", "statusPath": "/status", "expectedStatus": "active" },
  "instance": {
    "contractVersion": "1.0",
    "grantId": "cccccccc-cccc-4ccc-8ccc-cccccccccccc",
    "issuerInstitutionId": "algonquin.example",
    "subjectId": "workload.11111111-1111-4111-8111-111111111111",
    "keyRef": { "kind": "kek", "id": "kek.storage.project-vs01", "version": "3" },
    "operations": ["unwrap"],
    "purpose": "Decrypt the authorized VS-01 input during the active lease.",
    "context": { "institutionId": "algonquin.example", "dataClassification": "confidential", "resourceRefs": [{ "kind": "object", "id": "88888888-8888-4888-8888-888888888888" }], "aadDigest": "1515151515151515151515151515151515151515151515151515151515151515" },
    "notBefore": "2026-09-27T14:04:00Z",
    "expiresAt": "2026-09-27T14:19:20Z",
    "maxUses": 1,
    "status": "active",
    "policyDecision": { "decisionId": "dededede-dede-4ede-8ede-dededededede", "policyId": "policy.kms.operation", "policyVersion": "1.0.0", "outcome": "allow" },
    "approvals": [{ "approverId": "service.storage-authority", "role": "storage_authority", "approvedAt": "2026-09-27T14:04:00Z" }],
    "signature": { "algorithm": "Ed25519", "keyId": "did:web:algonquin.example#kms-authority-1", "canonicalization": "RFC8785", "signedAt": "2026-09-27T14:04:00Z", "value": "a21zLWdyYW50LXNpZ25hdHVyZQ" }
  }
}
