{
  "fixtureVersion": "1.0",
  "fixtureId": "positive.agent-sessions.session-envelope",
  "category": "positive",
  "schemaId": "urn:psdc:contracts:agent-sessions:session-envelope:1",
  "description": "Existing encrypted session-envelope contract remains covered by the unified runner.",
  "expected": { "schemaValid": true, "semanticOutcome": "accept" },
  "instance": {
    "contractVersion": "1.0",
    "envelopeId": "a7a7a7a7-a7a7-47a7-87a7-a7a7a7a7a7a7",
    "sessionId": "a4a4a4a4-a4a4-44a4-84a4-a4a4a4a4a4a4",
    "senderDeviceId": "a6a6a6a6-a6a6-46a6-86a6-a6a6a6a6a6a6",
    "sequence": 1,
    "createdAt": "2026-09-27T12:01:00Z",
    "expiresAt": "2026-09-27T13:01:00Z",
    "cipherSuite": "XChaCha20-Poly1305",
    "nonce": "bm9uY2U=",
    "ciphertext": "Y2lwaGVydGV4dA=="
  }
}
