{
  "fixtureVersion": "1.0",
  "fixtureId": "positive.compute.offer",
  "category": "positive",
  "schemaId": "urn:psdc:contracts:compute:offer:1",
  "description": "Time-bounded internal provider offer.",
  "expected": { "schemaValid": true, "semanticOutcome": "accept", "statusPath": "/status", "expectedStatus": "submitted" },
  "instance": {
    "contractVersion": "1.0",
    "offerId": "44444444-4444-4444-8444-444444444444",
    "requestId": "22222222-2222-4222-8222-222222222222",
    "providerId": "provider.algonquin.lab-a",
    "capabilityId": "capability.lab-a.gpu",
    "sequence": 7,
    "status": "submitted",
    "availableFrom": "2026-09-27T14:03:00Z",
    "expiresAt": "2026-09-27T14:08:00Z",
    "resources": { "cpuMillis": 2000, "memoryBytes": 4294967296, "gpuCount": 0, "ephemeralStorageBytes": 10737418240, "nodeCount": 1 },
    "prices": [{ "metric": "cpu_seconds", "billingUnit": "second", "price": { "unit": "IRU", "amount": "0.001" } }],
    "estimatedCarbonGrams": "0.25",
    "healthSnapshotDigest": "cccccccccccccccccccccccccccccccccccccccccccccccccccccccccccccccc",
    "policySnapshotDigest": "dddddddddddddddddddddddddddddddddddddddddddddddddddddddddddddddd",
    "signature": { "algorithm": "Ed25519", "keyId": "did:web:algonquin.example#provider-1", "canonicalization": "RFC8785", "signedAt": "2026-09-27T14:03:00Z", "value": "b2ZmZXItc2lnbmF0dXJlLTAx" }
  }
}
