{
  "fixtureVersion": "1.0",
  "fixtureId": "retry.compute.receipt-preempted-owner-reclaim",
  "category": "retry",
  "schemaId": "urn:psdc:contracts:compute:usage-receipt:1",
  "description": "Usage receipt for a lease evicted by the owner; outcome preempted and retryable on another provider.",
  "expected": {
    "schemaValid": true,
    "semanticOutcome": "retry",
    "reasonPath": "/reason/code",
    "expectedReasonCode": "OWNER_RECLAIM"
  },
  "instance": {
    "contractVersion": "1.0",
    "receiptId": "d86cc9de-5c45-4c52-889c-44a30ea6c00f",
    "leaseId": "66666666-6666-4666-8666-666666666666",
    "workloadId": "11111111-1111-4111-8111-111111111111",
    "providerId": "provider.algonquin.lab-a",
    "meterId": "meter.lab-a.v1",
    "sequence": 2,
    "attempt": 1,
    "interval": {
      "startedAt": "2026-09-27T14:04:20Z",
      "endedAt": "2026-09-27T14:05:00Z"
    },
    "status": "failed",
    "measurements": [
      {
        "metric": "cpu_seconds",
        "quantity": "38.5",
        "unit": "second",
        "source": "meter.lab-a.v1"
      }
    ],
    "outcome": "preempted",
    "evidence": [
      {
        "uri": "s3://evidence/failures/70707070",
        "digest": "7070707070707070707070707070707070707070707070707070707070707070",
        "classification": "internal",
        "retentionClass": "retention.audit.7y"
      }
    ],
    "recordedAt": "2026-09-27T14:05:05Z",
    "reason": {
      "code": "OWNER_RECLAIM",
      "message": "Interactive user returned.",
      "retryable": true
    },
    "signature": {
      "algorithm": "Ed25519",
      "keyId": "did:web:algonquin.example#meter-1",
      "canonicalization": "RFC8785",
      "signedAt": "2026-09-27T14:05:05Z",
      "value": "cmV0cnktcmVjZWlwdC1zaWduYXR1cmU"
    }
  }
}
