{
  "fixtureVersion": "1.0",
  "fixtureId": "positive.compute.provider",
  "category": "positive",
  "schemaId": "urn:psdc:contracts:compute:provider:1",
  "description": "Active institution-controlled campus provider.",
  "expected": { "schemaValid": true, "semanticOutcome": "accept", "statusPath": "/status", "expectedStatus": "active" },
  "instance": {
    "contractVersion": "1.0",
    "providerId": "provider.algonquin.lab-a",
    "institutionId": "algonquin.example",
    "displayName": "Example Campus Lab A",
    "providerType": "campus",
    "authorityDid": "did:web:algonquin.example",
    "status": "active",
    "trustTier": "pilot",
    "scopes": ["compute"],
    "sequence": 1,
    "issuedAt": "2026-09-27T14:00:00Z",
    "expiresAt": "2026-09-28T14:00:00Z",
    "endpoints": [{ "kind": "capability", "uri": "https://compute.algonquin.example/capabilities" }],
    "signature": { "algorithm": "Ed25519", "keyId": "did:web:algonquin.example#provider-1", "canonicalization": "RFC8785", "signedAt": "2026-09-27T14:00:00Z", "value": "cHJvdmlkZXItc2lnbmF0dXJl" }
  }
}
