{
  "fixtureVersion": "1.0",
  "fixtureId": "positive.events.event-envelope",
  "category": "positive",
  "schemaId": "urn:psdc:contracts:events:event-envelope:1",
  "description": "At-least-once workload-submitted event with explicit ordering and idempotency scope.",
  "expected": { "schemaValid": true, "semanticOutcome": "accept" },
  "instance": {
    "specversion": "1.0",
    "id": "16161616-1616-4161-8161-161616161616",
    "source": "/institutions/institution.example/compute/workload-api",
    "type": "org.psdc.compute.workload.submitted.v1",
    "subject": "workload/11111111-1111-4111-8111-111111111111",
    "time": "2026-09-29T12:00:00Z",
    "datacontenttype": "application/json",
    "dataschema": "urn:psdc:contracts:compute:workload-manifest:1",
    "institutionid": "institution.example",
    "classification": "internal",
    "schemaversion": "1.0",
    "correlationid": "17171717-1717-4171-8171-171717171717",
    "sequence": 1,
    "orderingscope": "workload.11111111-1111-4111-8111-111111111111",
    "idempotencykey": "workload-submitted-0001",
    "expiresat": "2026-09-30T12:00:00Z",
    "actor": { "kind": "service-account", "id": "subject.synthetic.requester" },
    "data": { "workloadId": "11111111-1111-4111-8111-111111111111" }
  }
}
