{
  "fixtureVersion": "1.0",
  "fixtureId": "retry.compute.receipt-worker-lost",
  "category": "retry",
  "schemaId": "urn:psdc:contracts:compute:usage-receipt:1",
  "description": "Failed attempt whose bounded reason permits a new workload attempt, not receipt mutation.",
  "expected": { "schemaValid": true, "semanticOutcome": "retry", "statusPath": "/status", "expectedStatus": "failed", "reasonPath": "/reason/code", "expectedReasonCode": "WORKER_LOST" },
  "instance": {
    "contractVersion": "1.0",
    "receiptId": "70707070-7070-4070-8070-707070707070",
    "leaseId": "66666666-6666-4666-8666-666666666666",
    "workloadId": "11111111-1111-4111-8111-111111111111",
    "providerId": "provider.algonquin.lab-a",
    "meterId": "meter.lab-a.v1",
    "sequence": 2,
    "attempt": 1,
    "interval": { "startedAt": "2026-09-27T14:04:20Z", "endedAt": "2026-09-27T14:05:00Z" },
    "status": "failed",
    "measurements": [{ "metric": "cpu_seconds", "quantity": "38.5", "unit": "second", "source": "meter.lab-a.v1" }],
    "outcome": "lost",
    "evidence": [{ "uri": "s3://evidence/failures/70707070", "digest": "7070707070707070707070707070707070707070707070707070707070707070", "classification": "internal", "retentionClass": "retention.audit.7y" }],
    "recordedAt": "2026-09-27T14:05:05Z",
    "reason": { "code": "WORKER_LOST", "message": "Worker heartbeat and session expired.", "retryable": true, "retryAfterSeconds": 30 },
    "signature": { "algorithm": "Ed25519", "keyId": "did:web:algonquin.example#meter-1", "canonicalization": "RFC8785", "signedAt": "2026-09-27T14:05:05Z", "value": "cmV0cnktcmVjZWlwdC1zaWduYXR1cmU" }
  }
}
