{
  "fixtureVersion": "1.0",
  "fixtureId": "positive.deployment.institution-manifest",
  "category": "positive",
  "schemaId": "urn:psdc:contracts:deployment:institution-manifest:1",
  "description": "Existing institution deployment manifest remains covered by the unified runner.",
  "expected": { "schemaValid": true, "semanticOutcome": "accept" },
  "instance": {
    "contractVersion": "1.0",
    "deploymentId": "algonquin.example",
    "sequence": 1,
    "issuedAt": "2026-09-27T12:00:00Z",
    "expiresAt": "2026-10-27T12:00:00Z",
    "branding": { "institutionName": "Example Institution", "productName": "Example Digital Commons", "supportUrl": "https://support.algonquin.example/", "privacyUrl": "https://algonquin.example/privacy" },
    "endpoints": { "portal": "https://commons.algonquin.example/", "aiGateway": "https://ai.algonquin.example/", "sessionRelay": "https://relay.algonquin.example/", "updateManifest": "https://updates.algonquin.example/manifest.json" },
    "oidc": { "issuer": "https://identity.algonquin.example/realms/commons", "authorizationFlow": "authorization_code_pkce", "webClientId": "commons-web", "desktopClientId": "commons-desktop", "mobileClientId": "commons-mobile", "scopes": ["openid", "profile"] },
    "trust": { "manifestSigningKeyId": "did:web:algonquin.example#deployment-1", "minimumClientVersion": "0.1.0" }
  }
}
