{
  "fixtureVersion": "1.0",
  "fixtureId": "positive.compute.usage-receipt",
  "category": "positive",
  "schemaId": "urn:psdc:contracts:compute:usage-receipt:1",
  "description": "Signed measured usage receipt with governed evidence reference.",
  "expected": { "schemaValid": true, "semanticOutcome": "accept", "statusPath": "/status", "expectedStatus": "measured" },
  "instance": {
    "contractVersion": "1.0",
    "receiptId": "77777777-7777-4777-8777-777777777777",
    "leaseId": "66666666-6666-4666-8666-666666666666",
    "workloadId": "11111111-1111-4111-8111-111111111111",
    "providerId": "provider.algonquin.lab-a",
    "meterId": "meter.lab-a.v1",
    "sequence": 1,
    "attempt": 1,
    "interval": { "startedAt": "2026-09-27T14:04:20Z", "endedAt": "2026-09-27T14:06:20Z" },
    "status": "measured",
    "measurements": [{ "metric": "cpu_seconds", "quantity": "180.25", "unit": "second", "source": "meter.lab-a.v1" }],
    "outcome": "succeeded",
    "evidence": [{ "uri": "s3://evidence/receipts/77777777", "digest": "1313131313131313131313131313131313131313131313131313131313131313", "classification": "internal", "retentionClass": "retention.audit.7y" }],
    "recordedAt": "2026-09-27T14:06:25Z",
    "signature": { "algorithm": "Ed25519", "keyId": "did:web:algonquin.example#meter-1", "canonicalization": "RFC8785", "signedAt": "2026-09-27T14:06:25Z", "value": "cmVjZWlwdC1zaWduYXR1cmU" }
  }
}
