{
  "fixtureVersion": "1.0",
  "fixtureId": "revocation.network.reservation",
  "category": "revocation",
  "schemaId": "urn:psdc:contracts:network:reservation:1",
  "description": "Revoked network reservation fenced at generation two.",
  "expected": { "schemaValid": true, "semanticOutcome": "revoked", "statusPath": "/status", "expectedStatus": "revoked", "reasonPath": "/reason/code", "expectedReasonCode": "POLICY_REVOKED" },
  "instance": {
    "contractVersion": "1.0",
    "reservationId": "90909090-9090-4090-8090-909090909090",
    "pathId": "path.lab-a.dc-a",
    "leaseId": "66666666-6666-4666-8666-666666666666",
    "workloadId": "11111111-1111-4111-8111-111111111111",
    "status": "revoked",
    "generation": 2,
    "issuedAt": "2026-09-27T14:04:00Z",
    "activateBy": "2026-09-27T14:05:00Z",
    "expiresAt": "2026-09-27T14:19:20Z",
    "terminalAt": "2026-09-27T14:08:00Z",
    "bandwidthMbps": 100,
    "qosClass": "bulk",
    "sourceZoneId": "zone.lab-a",
    "destinationZoneId": "zone.dc-a",
    "policyDecision": { "decisionId": "91919191-9191-4191-8191-919191919191", "policyId": "policy.network.reservation", "policyVersion": "1.0.1", "outcome": "deny" },
    "reason": { "code": "POLICY_REVOKED", "message": "Updated policy revoked the reservation.", "retryable": false },
    "signature": { "algorithm": "Ed25519", "keyId": "did:web:algonquin.example#network-1", "canonicalization": "RFC8785", "signedAt": "2026-09-27T14:08:00Z", "value": "cmV2b2tlZC1uZXR3b3JrLXNpZw" }
  }
}
